{
  "schema": "org.openastrolink.driver-manifest/v2",
  "driverId": "oal.qhy",
  "name": "OpenAstroLink native QHYCCD driver",
  "version": "0.2.10.47",
  "abiVersion": 2,
  "library": "oal_driver_qhy",
  "deviceClasses": [
    "camera"
  ],
  "isolation": "in-process",
  "permissions": [
    {
      "kind": "usb",
      "vendor": "QHYCCD"
    }
  ],
  "threadModel": "per-device-serial",
  "trust": "bundled",
  "config": {}
}
